{"$schema":"https://json-schema.org/draft/2020-12/schema","title":"Growth Intelligence Report","type":"object","additionalProperties":false,"required":["product_id","status","market_signal_hash","first_party_verified","findings","opportunities","errors","claims_boundary","deliverables","pricing_status","external_execution_authorized","customer_contacted","content_published","money_moved","report_hash"],"properties":{"product_id":{"const":"storefront_growth_intelligence"},"status":{"enum":["HOLD","MARKET_SIGNAL_ONLY","EVIDENCE_READY_FOR_HUMAN_REVIEW"]},"market_signal_hash":{},"first_party_verified":{"type":"boolean"},"findings":{"type":"array"},"opportunities":{"type":"array"},"errors":{"type":"array"},"claims_boundary":{"type":"object"},"deliverables":{"type":"array"},"pricing_status":{"const":"UNSET_REQUIRES_HUMAN_APPROVAL"},"external_execution_authorized":{"const":false},"customer_contacted":{"const":false},"content_published":{"const":false},"money_moved":{"const":false},"report_hash":{"type":"string"}}}
